{
  "id": "ring-60",
  "version": 1,
  "pixelCount": 60,
  "dimensions": 2,
  "fit": "contain",
  "points": [
    [
      1,
      0.5
    ],
    [
      0.9972609476841366,
      0.5522642316338268
    ],
    [
      0.9890738003669028,
      0.6039558454088797
    ],
    [
      0.9755282581475768,
      0.6545084971874737
    ],
    [
      0.9567727288213004,
      0.7033683215379001
    ],
    [
      0.9330127018922194,
      0.75
    ],
    [
      0.9045084971874737,
      0.7938926261462366
    ],
    [
      0.8715724127386971,
      0.8345653031794291
    ],
    [
      0.8345653031794291,
      0.8715724127386971
    ],
    [
      0.7938926261462366,
      0.9045084971874737
    ],
    [
      0.75,
      0.9330127018922193
    ],
    [
      0.7033683215379002,
      0.9567727288213004
    ],
    [
      0.6545084971874737,
      0.9755282581475768
    ],
    [
      0.6039558454088796,
      0.9890738003669028
    ],
    [
      0.5522642316338268,
      0.9972609476841366
    ],
    [
      0.5,
      1
    ],
    [
      0.44773576836617335,
      0.9972609476841368
    ],
    [
      0.3960441545911204,
      0.9890738003669028
    ],
    [
      0.34549150281252633,
      0.9755282581475768
    ],
    [
      0.2966316784620999,
      0.9567727288213005
    ],
    [
      0.2500000000000001,
      0.9330127018922194
    ],
    [
      0.2061073738537635,
      0.9045084971874737
    ],
    [
      0.16543469682057105,
      0.8715724127386972
    ],
    [
      0.12842758726130282,
      0.834565303179429
    ],
    [
      0.09549150281252633,
      0.7938926261462367
    ],
    [
      0.06698729810778065,
      0.75
    ],
    [
      0.04322727117869951,
      0.7033683215379001
    ],
    [
      0.024471741852423234,
      0.6545084971874737
    ],
    [
      0.010926199633097156,
      0.6039558454088797
    ],
    [
      0.002739052315863355,
      0.5522642316338269
    ],
    [
      0,
      0.5000000000000001
    ],
    [
      0.002739052315863355,
      0.44773576836617324
    ],
    [
      0.010926199633097156,
      0.39604415459112047
    ],
    [
      0.024471741852423234,
      0.34549150281252616
    ],
    [
      0.043227271178699456,
      0.2966316784621001
    ],
    [
      0.0669872981077807,
      0.24999999999999994
    ],
    [
      0.09549150281252627,
      0.2061073738537635
    ],
    [
      0.12842758726130288,
      0.16543469682057088
    ],
    [
      0.16543469682057077,
      0.128427587261303
    ],
    [
      0.20610737385376338,
      0.09549150281252633
    ],
    [
      0.24999999999999978,
      0.06698729810778076
    ],
    [
      0.2966316784620999,
      0.04322727117869951
    ],
    [
      0.3454915028125262,
      0.024471741852423234
    ],
    [
      0.3960441545911201,
      0.010926199633097211
    ],
    [
      0.4477357683661729,
      0.002739052315863355
    ],
    [
      0.4999999999999999,
      0
    ],
    [
      0.552264231633827,
      0.002739052315863355
    ],
    [
      0.6039558454088797,
      0.010926199633097211
    ],
    [
      0.6545084971874736,
      0.02447174185242318
    ],
    [
      0.7033683215378999,
      0.043227271178699456
    ],
    [
      0.75,
      0.0669872981077807
    ],
    [
      0.7938926261462365,
      0.09549150281252622
    ],
    [
      0.8345653031794292,
      0.128427587261303
    ],
    [
      0.8715724127386968,
      0.1654346968205706
    ],
    [
      0.9045084971874737,
      0.20610737385376332
    ],
    [
      0.9330127018922192,
      0.24999999999999978
    ],
    [
      0.9567727288213005,
      0.2966316784620999
    ],
    [
      0.9755282581475768,
      0.34549150281252616
    ],
    [
      0.9890738003669028,
      0.3960441545911201
    ],
    [
      0.9972609476841366,
      0.44773576836617285
    ]
  ]
}
