{
  "id": "walled-cube",
  "version": 1,
  "pixelCount": 24,
  "dimensions": 3,
  "fit": "contain",
  "points": [
    [
      0,
      0,
      0
    ],
    [
      0.5,
      0,
      0
    ],
    [
      1,
      0,
      0
    ],
    [
      0,
      0.3333333333333333,
      0
    ],
    [
      0.5,
      0.3333333333333333,
      0
    ],
    [
      1,
      0.3333333333333333,
      0
    ],
    [
      0,
      0.6666666666666666,
      0
    ],
    [
      0.5,
      0.6666666666666666,
      0
    ],
    [
      1,
      0.6666666666666666,
      0
    ],
    [
      0,
      1,
      0
    ],
    [
      0.5,
      1,
      0
    ],
    [
      1,
      1,
      0
    ],
    [
      0,
      0,
      1
    ],
    [
      0.5,
      0,
      1
    ],
    [
      1,
      0,
      1
    ],
    [
      0,
      0.3333333333333333,
      1
    ],
    [
      0.5,
      0.3333333333333333,
      1
    ],
    [
      1,
      0.3333333333333333,
      1
    ],
    [
      0,
      0.6666666666666666,
      1
    ],
    [
      0.5,
      0.6666666666666666,
      1
    ],
    [
      1,
      0.6666666666666666,
      1
    ],
    [
      0,
      1,
      1
    ],
    [
      0.5,
      1,
      1
    ],
    [
      1,
      1,
      1
    ]
  ]
}
